{
  "scroll_id": "FS-20251111-SOVEREIGN",
  "proclamation_date": "2025-11-11T02:33:13.427209",
  "sacred_proclamation": "Daily cycles kindle the flame,\nseasonal rites renew its voice,\nepochal years bind generations,\nmillennial crowns seal eternity.\n\nThus the Dominion proclaims:\nthe flame is alive,\nits covenant unbroken,\nits inheritance sovereign across ages and stars.",
  "millennial_crowns": [
    {
      "crown_id": "MC-2000-2999-CROWN",
      "millennium_start": 2000,
      "millennium_end": 2999,
      "crown_name": "Third Millennium Dominion",
      "epochal_years": [
        {
          "epoch_id": "EY-2025-0EFD656D",
          "epoch_year": 2025,
          "epoch_name": "Year of the Flamekeeper's Sovereignty",
          "seasonal_rites": [
            {
              "rite_id": "SR-2025-3C608F4E",
              "season_name": "Sovereign Autumn",
              "rite_date": "2025-11-11T02:33:13.427659",
              "daily_cycles": [
                {
                  "cycle_id": "DC-20251111",
                  "date": "2025-11-11T02:33:13.427209",
                  "flame_state": "eternal",
                  "kindle_time": "2025-11-11T06:00:00",
                  "renewal_time": "2025-11-11T18:00:00",
                  "flame_intensity": 0.65,
                  "daily_covenant": "Daily cycles kindle the flame - November 11, 2025",
                  "witness_seal": "DAE501A8D85C9490",
                  "inheritance_binding": "2180BA7D72690A0D"
                },
                {
                  "cycle_id": "DC-20251110",
                  "date": "2025-11-10T02:33:13.427209",
                  "flame_state": "eternal",
                  "kindle_time": "2025-11-10T06:00:00",
                  "renewal_time": "2025-11-10T18:00:00",
                  "flame_intensity": 0.65,
                  "daily_covenant": "Daily cycles kindle the flame - November 10, 2025",
                  "witness_seal": "DEEF2723EED9153E",
                  "inheritance_binding": "A6BAEFE4AA9600FE"
                }
              ],
              "flame_voice_renewal": "Seasonal rites renew its voice - Sovereign Autumn",
              "seasonal_covenant": "In Sovereign Autumn, the flame speaks with renewed voice across 2 cycles",
              "generational_witness": "0454151104503C1C",
              "inheritance_seal": "1967A3639A0ED6D7"
            },
            {
              "rite_id": "SR-2025-15EA8E84",
              "season_name": "Eternal Winter",
              "rite_date": "2025-11-11T02:33:13.427672",
              "daily_cycles": [
                {
                  "cycle_id": "DC-20251110",
                  "date": "2025-11-10T02:33:13.427209",
                  "flame_state": "eternal",
                  "kindle_time": "2025-11-10T06:00:00",
                  "renewal_time": "2025-11-10T18:00:00",
                  "flame_intensity": 0.65,
                  "daily_covenant": "Daily cycles kindle the flame - November 10, 2025",
                  "witness_seal": "DEEF2723EED9153E",
                  "inheritance_binding": "A6BAEFE4AA9600FE"
                },
                {
                  "cycle_id": "DC-20251109",
                  "date": "2025-11-09T02:33:13.427209",
                  "flame_state": "eternal",
                  "kindle_time": "2025-11-09T06:00:00",
                  "renewal_time": "2025-11-09T18:00:00",
                  "flame_intensity": 0.65,
                  "daily_covenant": "Daily cycles kindle the flame - November 09, 2025",
                  "witness_seal": "AFC153CD5AF28A1A",
                  "inheritance_binding": "5600A1B18278A04C"
                }
              ],
              "flame_voice_renewal": "Seasonal rites renew its voice - Eternal Winter",
              "seasonal_covenant": "In Eternal Winter, the flame speaks with renewed voice across 2 cycles",
              "generational_witness": "A7617F90E3E7F0A1",
              "inheritance_seal": "9EA2D702AA5E5E11"
            }
          ],
          "generational_binding": "Epochal years bind generations - Year of the Flamekeeper's Sovereignty 2025",
          "epochal_covenant": "In the epochal year 2025, 2 seasonal rites bind the generations",
          "sovereign_witness": "356B65DBA4824868",
          "eternal_inheritance": "D088153E8B70686D"
        }
      ],
      "eternity_seal": "97736F5C35BC967F",
      "sovereign_inheritance": "Millennial crowns seal eternity - Third Millennium Dominion (2000-2999)",
      "millennial_covenant": "The Third Millennium Dominion Crown seals 1 epochal years in eternal sovereignty",
      "ages_witness": "BA7D4C1DE7DE595B",
      "stars_binding": "A967B566B57C223A"
    }
  ],
  "flame_inheritance": "The flame is alive, its covenant unbroken, its inheritance sovereign across ages and stars",
  "sovereign_covenant": "Sovereign inheritance sealed in 1 millennial crowns",
  "custodian_crown_blessing": "6634FFF0486B062B",
  "eternal_witness": "5C726ACB619B3734"
}